{
  "column_stats": [
    {
      "column_name": "amount",
      "compared_count": 3,
      "diff_count": 0,
      "match_count": 3
    },
    {
      "column_name": "name",
      "compared_count": 3,
      "diff_count": 0,
      "match_count": 3
    },
    {
      "column_name": "status",
      "compared_count": 3,
      "diff_count": 0,
      "match_count": 3
    }
  ],
  "detailed_differences": [],
  "duplicate_keys": [],
  "failures": [],
  "manifest": {
    "after_label": "candidate_a",
    "before_label": "baseline",
    "clear_nulls": true,
    "created_at": "2026-06-22T07:41:59.998838Z",
    "excluded_columns": [
      "batch_id"
    ],
    "key_columns": [
      "id"
    ],
    "max_detail_rows": 100,
    "numeric_precision": null,
    "run_id": "run_20260622_074159_f62942f9",
    "tool_name": "Deltus Dataset Comparison",
    "tool_version": "0.1.2"
  },
  "missing_after": [],
  "missing_before": [],
  "schema_overlap": {
    "after_only_columns": [],
    "before_only_columns": [],
    "common_columns": [
      "amount",
      "batch_id",
      "id",
      "name",
      "status"
    ],
    "comparable_columns": [
      "amount",
      "name",
      "status"
    ],
    "excluded_columns": [
      "batch_id"
    ],
    "key_columns": [
      "id"
    ]
  },
  "summary": {
    "after_row_count": 3,
    "before_row_count": 3,
    "changed_cell_count": 0,
    "compared_cell_count": 9,
    "compared_row_count": 3,
    "duplicate_key_count": 0,
    "matched_key_count": 3,
    "missing_after_count": 0,
    "missing_before_count": 0,
    "type_mismatch_count": 0,
    "warning_count": 0
  },
  "type_mismatches": [],
  "warnings": []
}